{
  "$schema": "http://json-schema.org/draft-07/schema#",
  "$id": "https://yivanx.github.io/schema/viaje.schema.json",
  "title": "Viaje",
  "description": "Un viaje completo de Bitácora. La aplicación no sabe nada de ningún destino concreto: todo lo que se ve en pantalla sale de un archivo con esta forma.",
  "type": "object",
  "required": ["id", "titulo", "estado", "fechas", "lugares", "dias"],
  "additionalProperties": false,
  "properties": {
    "id": {
      "type": "string",
      "pattern": "^[a-z0-9]+(-[a-z0-9]+)*$",
      "description": "Identificador en kebab-case. Debe coincidir con el nombre del archivo y con la entrada de data/viajes.json."
    },
    "version": { "type": "integer", "minimum": 1 },
    "titulo": { "type": "string", "minLength": 1 },
    "subtitulo": { "type": "string" },
    "estado": {
      "enum": ["planificado", "en-curso", "completado"],
      "description": "El estado se calcula solo a partir de las fechas si no se toca, pero se puede fijar a mano."
    },
    "fechas": {
      "type": "object",
      "required": ["inicio", "fin"],
      "additionalProperties": false,
      "properties": {
        "inicio": { "type": "string", "format": "date", "pattern": "^\\d{4}-\\d{2}-\\d{2}$" },
        "fin": { "type": "string", "format": "date", "pattern": "^\\d{4}-\\d{2}-\\d{2}$" }
      }
    },
    "viajeros": { "type": "array", "items": { "type": "string" } },
    "moneda": { "type": "string", "description": "Código ISO 4217. EUR, USD, JPY…" },
    "base": { "type": "string", "description": "Dónde se duerme, en una línea." },
    "resumen": { "type": "string" },
    "mapa": {
      "type": "object",
      "additionalProperties": false,
      "properties": {
        "centro": { "$ref": "#/definitions/coords" },
        "zoom": { "type": "number", "minimum": 1, "maximum": 19 }
      },
      "description": "Encuadre inicial de la vista general. Si se omite, se calcula del conjunto de lugares."
    },
    "avisos": {
      "type": "array",
      "description": "Lo que puede romper el viaje. Sin dias ni momento sale en la portada del viaje; con ellos sube al día o a los preparativos, que es donde de verdad se lee.",
      "items": {
        "type": "object",
        "required": ["titulo", "texto"],
        "additionalProperties": false,
        "properties": {
          "nivel": { "enum": ["alto", "medio", "info"], "default": "info" },
          "titulo": { "type": "string" },
          "texto": { "type": "string" },
          "dias": { "$ref": "#/definitions/dias" },
          "momento": { "$ref": "#/definitions/momento" }
        }
      }
    },
    "lugares": {
      "type": "array",
      "minItems": 1,
      "description": "Catálogo plano. Un lugar se define una vez y se referencia desde los días por su id.",
      "items": { "$ref": "#/definitions/lugar" }
    },
    "dias": {
      "type": "array",
      "minItems": 1,
      "items": { "$ref": "#/definitions/dia" }
    },
    "transporte": {
      "type": "array",
      "items": {
        "type": "object",
        "required": ["tramo", "modo"],
        "additionalProperties": false,
        "properties": {
          "tramo": { "type": "string" },
          "modo": { "$ref": "#/definitions/modo" },
          "servicio": { "type": "string" },
          "duracion": { "type": "string" },
          "frecuencia": { "type": "string" },
          "precio": { "type": "string" },
          "descuento": { "type": "string" },
          "nota": { "type": "string" }
        }
      }
    },
    "listas": {
      "type": "array",
      "description": "Checklists persistentes. El marcado se guarda en el navegador, nunca en el repositorio. Sin dias ni momento la lista es del viaje entero.",
      "items": {
        "type": "object",
        "required": ["titulo", "items"],
        "additionalProperties": false,
        "properties": {
          "titulo": { "type": "string" },
          "dias": { "$ref": "#/definitions/dias" },
          "momento": { "$ref": "#/definitions/momento" },
          "items": {
            "type": "array",
            "items": {
              "type": "object",
              "required": ["id", "texto"],
              "additionalProperties": false,
              "properties": {
                "id": { "type": "string", "pattern": "^[a-z0-9]+(-[a-z0-9]+)*$" },
                "texto": { "type": "string" },
                "detalle": { "type": "string" }
              }
            }
          }
        }
      }
    },
    "presupuesto": {
      "type": "object",
      "additionalProperties": false,
      "properties": {
        "nota": { "type": "string" },
        "partidas": {
          "type": "array",
          "items": {
            "type": "object",
            "required": ["concepto", "importe"],
            "additionalProperties": false,
            "properties": {
              "concepto": { "type": "string" },
              "importe": { "type": "string" },
              "destacado": { "type": "boolean" }
            }
          }
        }
      }
    },
    "fuentes": {
      "type": "array",
      "items": {
        "type": "object",
        "required": ["texto", "url"],
        "additionalProperties": false,
        "properties": {
          "texto": { "type": "string" },
          "url": { "type": "string", "format": "uri" }
        }
      }
    }
  },
  "definitions": {
    "coords": {
      "type": "array",
      "minItems": 2,
      "maxItems": 2,
      "items": { "type": "number" },
      "description": "[latitud, longitud] en grados decimales. Latitud −90..90, longitud −180..180."
    },
    "categoria": {
      "enum": ["patrimonio", "naturaleza", "comida", "pueblo", "transporte", "alojamiento", "practico", "actividad"],
      "description": "Determina el color y el icono. El color solo significa categoría: nunca se usa para decorar."
    },
    "modo": {
      "enum": ["a-pie", "tren", "bus", "taxi", "coche", "barco", "avion", "bici"]
    },
    "dias": {
      "type": "array",
      "minItems": 1,
      "items": { "type": "string", "pattern": "^\\d{4}-\\d{2}-\\d{2}$" },
      "description": "A qué días del viaje aplica esto. Cada fecha tiene que caer dentro de fechas.inicio..fin: una fuera del rango es una errata que escondería el aviso en silencio, y el validador la rechaza."
    },
    "momento": {
      "enum": ["pre", "post"],
      "description": "\"pre\" lo sube a Preparativos y \"post\" a Al volver. Se puede combinar con dias: lo que se reserva antes de salir y además importa el día que toca sale en los dos sitios, a propósito."
    },
    "franja": {
      "type": "array",
      "minItems": 2,
      "maxItems": 2,
      "items": { "type": "string", "pattern": "^([01]\\d|2[0-4]):[0-5]\\d$" },
      "description": "[\"HH:MM\", \"HH:MM\"]. Una franja de apertura. 24:00 vale como cierre a medianoche."
    },
    "lugar": {
      "type": "object",
      "required": ["id", "nombre", "categoria", "coords", "resumen"],
      "additionalProperties": false,
      "properties": {
        "id": { "type": "string", "pattern": "^[a-z0-9]+(-[a-z0-9]+)*$" },
        "nombre": { "type": "string" },
        "categoria": { "$ref": "#/definitions/categoria" },
        "zona": { "type": "string", "description": "Agrupa lugares en el buscador y en la vista general." },
        "coords": { "$ref": "#/definitions/coords" },
        "resumen": { "type": "string", "description": "Una línea. Es lo que se ve en la lista y en el globo del mapa." },
        "descripcion": { "type": "string", "description": "Markdown ligero: párrafos, **negrita**, *cursiva* y listas con guion." },
        "duracionMin": { "type": "integer", "minimum": 0 },
        "precio": {
          "type": "object",
          "required": ["importe"],
          "additionalProperties": false,
          "properties": {
            "importe": { "type": "number", "minimum": 0 },
            "detalle": { "type": "string" }
          }
        },
        "horarios": {
          "type": "object",
          "additionalProperties": false,
          "description": "Por día de la semana. Un día ausente significa cerrado. Sin objeto horarios, el lugar se considera siempre accesible.",
          "properties": {
            "lun": { "type": "array", "items": { "$ref": "#/definitions/franja" } },
            "mar": { "type": "array", "items": { "$ref": "#/definitions/franja" } },
            "mie": { "type": "array", "items": { "$ref": "#/definitions/franja" } },
            "jue": { "type": "array", "items": { "$ref": "#/definitions/franja" } },
            "vie": { "type": "array", "items": { "$ref": "#/definitions/franja" } },
            "sab": { "type": "array", "items": { "$ref": "#/definitions/franja" } },
            "dom": { "type": "array", "items": { "$ref": "#/definitions/franja" } }
          }
        },
        "reserva": {
          "type": "object",
          "required": ["necesaria"],
          "additionalProperties": false,
          "properties": {
            "necesaria": { "type": "boolean" },
            "nota": { "type": "string" }
          }
        },
        "nivel": {
          "enum": ["obligatorio", "recomendable", "opcional"],
          "description": "Cuánto duele saltárselo. NO es opinión propia: sale de las reseñas declaradas en `valoracion`. Obligatorio = nota alta con mucho volumen o cabeza del ranking de su zona. Recomendable = buena nota con volumen medio. Opcional = nota o volumen bajos, o no es un destino en sí."
        },
        "valoracion": {
          "type": "object",
          "required": ["fuente"],
          "additionalProperties": false,
          "description": "La prueba detrás del nivel. Sin esto, el nivel es una opinión disfrazada de dato.",
          "properties": {
            "nota": { "type": "number", "minimum": 0, "maximum": 5 },
            "resenas": { "type": "integer", "minimum": 0 },
            "puesto": { "type": "string", "description": "Su puesto en el ranking de su localidad, tal cual lo da la fuente." },
            "fuente": { "type": "string", "description": "De dónde salen los números y cuándo se consultaron." }
          }
        },
        "queMirar": {
          "type": "array",
          "description": "Lo concreto que hay que buscar con los ojos estando allí. Se pinta como lista marcable: se va tachando sobre el terreno. No es lo mismo que consejos, que es logística.",
          "items": {
            "type": "object",
            "required": ["que"],
            "additionalProperties": false,
            "properties": {
              "que": { "type": "string", "description": "Qué buscar. Corto y concreto." },
              "porque": { "type": "string", "description": "Por qué merece la pena. Aquí va el dato que lo hace interesante." }
            }
          }
        },
        "curiosidades": {
          "type": "array",
          "description": "Datos que se cuentan luego. Van en tarjetas sueltas, no enterrados en un párrafo.",
          "items": {
            "type": "object",
            "required": ["titulo", "texto"],
            "additionalProperties": false,
            "properties": {
              "titulo": { "type": "string", "description": "El gancho, en pocas palabras." },
              "texto": { "type": "string", "description": "El dato. Dos o tres frases como mucho." }
            }
          }
        },
        "consejos": { "type": "array", "items": { "type": "string" } },
        "enlaces": {
          "type": "array",
          "items": {
            "type": "object",
            "required": ["texto", "url"],
            "additionalProperties": false,
            "properties": {
              "texto": { "type": "string" },
              "url": { "type": "string", "format": "uri" }
            }
          }
        },
        "imagen": {
          "type": "object",
          "required": ["archivo", "credito"],
          "additionalProperties": false,
          "description": "Foto representativa del lugar: se ve en la cronología, en el globo del mapa y como cabecera de la ficha. Vive en el repositorio para que siga estando sin conexión. Si viene de un tercero, credito y licencia son obligatorios y se muestran en pantalla.",
          "properties": {
            "archivo": { "type": "string", "description": "Ruta relativa a la raíz del sitio." },
            "credito": { "type": "string", "description": "Autor. Se muestra bajo la foto." },
            "licencia": { "type": ["string", "null"], "description": "CC BY-SA 4.0, Public domain… Obligatoria si la foto no es propia." },
            "fuente": { "type": "string", "description": "URL del original, para poder comprobar la licencia." }
          }
        },
        "fotos": {
          "type": "array",
          "description": "Fotos publicadas en el repositorio, relativas a la raíz del sitio. Las fotos privadas viven en IndexedDB y no aparecen aquí.",
          "items": {
            "type": "object",
            "required": ["archivo"],
            "additionalProperties": false,
            "properties": {
              "archivo": { "type": "string" },
              "pie": { "type": "string" }
            }
          }
        },
        "verificado": {
          "type": "object",
          "required": ["fecha", "fuente"],
          "additionalProperties": false,
          "description": "Cuándo se comprobó este dato y contra qué. Sin esto, un horario es un rumor.",
          "properties": {
            "fecha": { "type": "string", "pattern": "^\\d{4}-\\d{2}-\\d{2}$" },
            "fuente": { "type": "string" }
          }
        }
      }
    },
    "dia": {
      "type": "object",
      "required": ["fecha", "titulo", "bloques"],
      "additionalProperties": false,
      "properties": {
        "fecha": { "type": "string", "pattern": "^\\d{4}-\\d{2}-\\d{2}$" },
        "titulo": { "type": "string" },
        "intensidad": { "enum": ["llegada", "suave", "media", "fuerte", "salida"] },
        "resumen": { "type": "string" },
        "bloques": { "type": "array", "items": { "$ref": "#/definitions/bloque" } }
      }
    },
    "bloque": {
      "type": "object",
      "description": "Tres formas: visita (lleva lugar), traslado (tipo traslado, lleva modo/desde/hasta) e hito (tipo hito, lleva titulo).",
      "additionalProperties": false,
      "properties": {
        "tipo": { "enum": ["visita", "traslado", "hito"], "default": "visita" },
        "inicio": { "type": "string", "pattern": "^([01]\\d|2[0-4]):[0-5]\\d$" },
        "fin": { "type": "string", "pattern": "^([01]\\d|2[0-4]):[0-5]\\d$" },
        "lugar": { "type": "string", "description": "Solo en bloques de visita. Debe existir en lugares[]." },
        "nota": { "type": "string" },
        "titulo": { "type": "string", "description": "Solo en bloques de hito." },
        "detalle": { "type": "string" },
        "modo": { "$ref": "#/definitions/modo" },
        "desde": { "type": "string", "description": "Solo en traslados. Debe existir en lugares[]." },
        "hasta": { "type": "string", "description": "Solo en traslados. Debe existir en lugares[]." },
        "opcional": {
          "type": "boolean",
          "description": "El bloque se puede saltar sin romper el día. Se marca en la cronología para poder decidirlo sobre la marcha, cansado y con el reloj encima."
        },
        "exterior": {
          "type": "boolean",
          "description": "Se ve por fuera: fachada, mirador, edificio iluminado de noche. No se entra, así que el horario de taquilla no aplica y la validación no lo comprueba."
        }
      }
    }
  }
}
