{
  "id": "edimburgo-2026-10",
  "version": 1,
  "titulo": "Birmingham y Edimburgo",
  "subtitulo": "Una tarde en Birmingham, cuatro días en Edimburgo y uno en las Highlands",
  "estado": "planificado",
  "fechas": {
    "inicio": "2026-10-19",
    "fin": "2026-10-24"
  },
  "viajeros": [
    "La pareja de Yixuan",
    "Su madre"
  ],
  "moneda": "GBP",
  "base": "Una noche junto a Broad Street, en Birmingham, y cuatro junto a Haymarket, en Edimburgo",
  "resumen": "Se aterriza en Birmingham el lunes a las 11:00 y hay una tarde para los canales, la biblioteca y un balti para cenar. El martes, vuelo de madrugada a Edimburgo, la galería nacional y un free tour hasta Dean Village. El miércoles, el castillo y el free tour de Harry Potter por la Ciudad Vieja. El jueves, Holyrood, el parque y un free tour de fantasmas al anochecer. El viernes, excursión en español a las Highlands y al lago Ness, y el sábado, el jardín botánico antes de volar a las 16:00. Los tres free tours y la excursión son de Civitatis.",
  "mapa": {
    "centro": [
      55.95,
      -3.195
    ],
    "zoom": 13
  },
  "avisos": [
    {
      "nivel": "alto",
      "titulo": "Sin la ETA no se embarca",
      "texto": "Desde el 2 de abril de 2025, quien viaja al Reino Unido con pasaporte español o de otro país europeo necesita una autorización electrónica, la ETA. Cuesta 20 £ por persona y se pide en la app oficial «UK ETA» o en gov.uk/eta, nunca en webs intermediarias, que cobran más. Casi todas se aprueban en minutos, pero alguna tarda hasta tres días laborables, así que si no está pedida, hay que pedirla hoy mismo. Dura dos años. Y hace falta el pasaporte: el DNI ya no vale para entrar.",
      "dias": [
        "2026-10-19"
      ],
      "momento": "pre"
    },
    {
      "nivel": "alto",
      "titulo": "El martes se sale del hotel a las 6:00",
      "texto": "El vuelo a Edimburgo aterriza a las 9:00, así que despega hacia las 7:50 (hay que mirar la hora exacta en el billete). Con el aeropuerto a media hora en taxi, lo sensato es salir a las 6:00 y estar allí a las 6:35. El taxi conviene pedirlo el lunes por la noche en recepción o dejar el Uber programado. La factura del hotel, mejor dejarla pagada la víspera.",
      "dias": [
        "2026-10-19",
        "2026-10-20"
      ]
    },
    {
      "nivel": "alto",
      "titulo": "Las entradas del castillo, compradas antes",
      "texto": "Se compran por internet con hora de entrada, y cuando se agotan en la web ya no venden en la puerta. Cuestan 23,50 £ por internet y 26 £ en taquilla; los mayores de 65 pagan 19 £. El plan cuenta con la franja de las 9:30, que es la más tranquila. Abre de 9:30 a 17:00 y la última entrada es a las 16:00.",
      "dias": [
        "2026-10-21"
      ],
      "momento": "pre"
    },
    {
      "nivel": "medio",
      "titulo": "Los free tours: reservar y llevar propina",
      "texto": "Son tres, todos de Civitatis y en español: Dean Village el martes a las 14:30, Harry Potter el miércoles a las 13:30 y fantasmas el jueves a las 18:00. La reserva es gratis y al final se paga lo que se quiera; Civitatis recomienda 10-15 € por persona. Algunos guías solo aceptan efectivo, así que conviene llevar unas 40 £ en billetes. Si al final no se va, hay que cancelar, porque el guía espera.",
      "dias": [
        "2026-10-20",
        "2026-10-21",
        "2026-10-22"
      ],
      "momento": "pre"
    },
    {
      "nivel": "alto",
      "titulo": "La excursión a las Highlands va el viernes, y en español",
      "texto": "Es la «Excursión por lo mejor de las Highlands» de Civitatis, con guía en español: 77,10 € por persona, salida a las 7:15 de St Andrew's House (2 Regent Road) y unas 13 horas. Iba a ir el jueves, pero ese día no tiene salida: solo sale el 20, el 21, el 23 y el 24. El viernes es además el día con mejor previsión allí arriba: 0,1 mm en Glencoe y nada en el lago Ness, según Open-Meteo el 18 de octubre. Se cancela gratis hasta 48 horas antes. El crucero por el lago Ness se paga aparte: 21 £, o 19 £ los mayores de 65.",
      "dias": [
        "2026-10-23"
      ],
      "momento": "pre"
    },
    {
      "nivel": "medio",
      "titulo": "Holyrood cierra los martes y los miércoles",
      "texto": "Del 10 de septiembre al 31 de octubre abre de jueves a lunes, de 9:30 a 18:00, con la última entrada a las 16:30. Por eso va el jueves. Es palacio real en uso, así que puede cerrar con poco aviso: conviene mirar la web de la Royal Collection la víspera.",
      "dias": [
        "2026-10-22"
      ]
    },
    {
      "nivel": "medio",
      "titulo": "San Giles cobra entrada desde el 5 de octubre",
      "texto": "La catedral empezó a cobrar 12 £ a los visitantes que no viven en Escocia el 5 de octubre de 2026, según la prensa local; la web de la catedral no lo detallaba aún. El plan la deja como parada corta: la fachada, el mosaico del corazón en el suelo y, si apetece, entrar.",
      "dias": [
        "2026-10-21"
      ]
    },
    {
      "nivel": "medio",
      "titulo": "El sábado: maletas y aeropuerto",
      "texto": "El check-out es a las 11:00 y el vuelo sale a las 16:00. Las maletas se dejan en recepción por la mañana y se recogen a las 12:20. El tranvía al aeropuerto sale de Haymarket, a cinco minutos del hotel, y tarda unos 20-25 minutos: con cogerlo a las 13:10 se llega con más de dos horas de margen.",
      "dias": [
        "2026-10-24"
      ],
      "momento": "pre"
    },
    {
      "nivel": "info",
      "titulo": "El museo de Birmingham cierra los lunes",
      "texto": "Desde julio de 2026 abre seis días a la semana en periodo escolar, y el lunes 19 no es vacaciones allí. Por eso no está en el plan, aunque esté en la misma plaza que la biblioteca.",
      "dias": [
        "2026-10-19"
      ]
    },
    {
      "nivel": "info",
      "titulo": "Se paga en libras, y casi todo con tarjeta",
      "texto": "1 € = 0,84385 £ según el Banco Central Europeo el 16 de octubre de 2026, así que 1 £ son unos 1,19 €. Se paga con tarjeta sin contacto en casi todas partes, también en los autobuses. Cuando el datáfono ofrezca cobrar en euros, hay que elegir libras: el cambio del comercio siempre es peor."
    },
    {
      "nivel": "info",
      "titulo": "Cómo se ha clasificado cada sitio",
      "texto": "Esta vez TripAdvisor bloqueó la consulta, así que no hay notas de reseñas. Obligatorio = lo más visitado de Escocia según las cifras de ALVA de 2025, o lo que está en el centro de lo que se pidió: historia y castillos, miradores, Harry Potter y comida. Recomendable = lo que encaja con eso y se puede saltar si el día se tuerce. Opcional = lo demás. Salvo los que citan a ALVA, los niveles son criterio, no un dato. Los free tours y la excursión llevan la nota de Civitatis, sobre 10."
    }
  ],
  "lugares": [
    {
      "id": "aeropuerto-bhx",
      "nombre": "Aeropuerto de Birmingham",
      "categoria": "transporte",
      "zona": "Aeropuerto de Birmingham",
      "coords": [
        52.45418,
        -1.74387
      ],
      "resumen": "Se llega el lunes y se vuelve a salir de aquí el martes de madrugada, rumbo a Edimburgo.",
      "descripcion": "El lunes se aterriza en un vuelo internacional, así que hay control de pasaportes: con eso y las maletas, se sale hacia las 11:45.\n\nPara ir al centro, el **Air-Rail Link** es un tren automático y gratuito que en dos minutos deja en la estación de **Birmingham International**. Desde allí, los trenes a **New Street** tardan unos 10-20 minutos. El taxi directo al hotel cuesta unas 25-40 £ y tarda entre 25 y 40 minutos, según el tráfico.\n\nEl martes el vuelo a Edimburgo es nacional: no hay control de pasaportes, pero la aerolínea pide un documento con foto, y el que vale es el pasaporte.",
      "duracionMin": 45,
      "nivel": "opcional",
      "valoracion": {
        "puesto": "No es un destino",
        "fuente": "Es el medio para llegar, no una visita"
      },
      "consejos": [
        "El billete de tren a New Street se saca en la máquina de Birmingham International o en la app Trainline; ronda las 4-8 £ por persona.",
        "El martes conviene llegar a las 6:35 para un vuelo hacia las 7:50: la facturación de equipaje cierra mucho antes que la puerta."
      ],
      "imagen": {
        "archivo": "data/viajes/edimburgo-2026-10/fotos/aeropuerto-bhx.jpg",
        "credito": "No se ha podido leer automáticamente información sobre el autor; se as",
        "licencia": "Public domain",
        "fuente": "https://commons.wikimedia.org/wiki/File:Birmingham_airport_entrance.JPG"
      },
      "verificado": {
        "fecha": "2026-10-18",
        "fuente": "Guías de transporte del aeropuerto (airconnect.live) y OpenStreetMap (aeroway=aerodrome)"
      }
    },
    {
      "id": "new-street",
      "nombre": "Estación de New Street",
      "categoria": "transporte",
      "zona": "Centro de Birmingham",
      "coords": [
        52.47765,
        -1.89869
      ],
      "resumen": "La estación central, con el tranvía en la puerta para ir a Broad Street.",
      "descripcion": "Encima de la estación está el centro comercial **Grand Central**, y en su puerta para el tranvía del **West Midlands Metro**. En ocho o diez minutos deja en la parada de **Brindleyplace**, en Broad Street, al lado del hotel. Andando son unos 20 minutos.",
      "duracionMin": 10,
      "nivel": "opcional",
      "valoracion": {
        "puesto": "No es un destino",
        "fuente": "Es un punto de paso"
      },
      "consejos": [
        "El billete sencillo del tranvía cuesta 2,50 £ desde enero de 2026, y se paga con la tarjeta sin contacto al validar."
      ],
      "imagen": {
        "archivo": "data/viajes/edimburgo-2026-10/fotos/new-street.jpg",
        "credito": "Fatih Renkligil",
        "licencia": "CC BY-SA 4.0",
        "fuente": "https://commons.wikimedia.org/wiki/File:Birmingham%20Grand%20Central%20Exterior.jpg"
      },
      "verificado": {
        "fecha": "2026-10-18",